{
  "verdict": "pass",
  "reasons": [
    "Pass one, bindings: 41 el_ids declared across 6 panels (claim_map spine n1-n4, edges e1-e4, hidden h1-h6; scale_check segments and chips; money_flow rows; incidence lanes; options and playbook steps; family marker mbgstop-p-family), no duplicates. All 90 els entries across 12 sentences in both locales resolve to a declared id. None unresolved.",
    "Pass one, coverage: every panel's own el_id is bound in BOTH locales. claim_map en v-1 / id v-1; scale_check en v-5 / id v-3; money_flow en v-3 / id v-4; incidence en v-4 / id v-5; options en v-6 / id v-6; family en v-2 / id v-2. No uncovered panel. No declared element is left unbound in either locale.",
    "Pass one, orphan numbers: all 27 Value objects carry a source_id, including the two flagged self_reported and the one flagged self_reported+estimate. None orphaned. candidate.counts recomputes correctly against the 6.5 derivation: missing=2 (e3,e4), unsourced=3 (e1,e2 plus h6, the single hidden entry with no ev), disputed=0, supported=0, hidden=6.",
    "Pass one, lexicon 6.9: zero whole-word verdict hits across 492 user-facing copy strings in both locales for all 19 banned words, zero matches on the fact-check colon construction, no salah satu trap present, no scalar quality score for a narrative or an outlet anywhere. Style: the candidate contains zero non-ASCII characters, so no em dash and no emoji in any locale. Future-tense harm is not reachable: echo is null and there is no case-library surface, so neither historical.outcome nor cases.documented_outcome exists in this artifact.",
    "Pass two, figures: every number in prose resolves inside its own sentence's bound elements, checked mechanically in both locales and both number formats. en v-3 (88.15, 29,679, 987,000), en v-4 (63.13M, 1.28M, 142,387), en v-5 (88.15, 3,842.7, 599.44, 210.06, 689.1, 9,920.42), id v-3 and id v-4 likewise. No figure resolves to nothing.",
    "Pass two, edge status: no upgrade in either locale. en v-2 'two rest on no entry in the source registry' and id v-2 'dua hanya dinyatakan oleh judul' both describe e1 and e2 as unsourced, matching each edge's own ev.why ('The headline asserts the step... no entry in it states that...'). en v-2 'stated by no article in this family' and id v-2 'tidak dinyatakan oleh artikel mana pun dalam keluarga ini' match the literal quote text of the two missing edges e3 and e4. Neither locale describes a missing edge as supported.",
    "Pass two, family binding: mbgstop-p-family is a contract-valid declared element (6.4 FamilyPanel is exactly {type:'family', el_id}, additionalProperties false, confirmed in contracts/schemas/narrative.schema.json). en v-2 and id v-2 bind it for the phrase 'in this family' / 'dalam keluarga ini', which the panel's three declared members define and which the bound edges e3 and e4 carry as their evidence. The binding is legitimate and the claim traces.",
    "Pass two, named parties and characterisations: the three proponents (Purbaya Yudhi Sadewa, Dadan Hindayana, Taruna Ikrar) are declared verbatim by the three bound option elements in en v-6 and id v-6. 'The body running the programme' traces to the bound money_flow row notes plus their self_reported flags. The 987,000 derived-estimate characterisation traces to mbgstop-row-workers-feb's own note; 'the part no future stop can turn into savings' traces to mbgstop-row-disbursed (severed_if_stopped false) and h5; 'the treasury is not first to bear it' traces to the bound lane-treasury cells. Every sentence in both locales traces.",
    "Process note, not a fault in the artifact: the hash quoted in the handoff (df7b90d4aebdaccb46a715f715a92a9cf366b8aaa1bfb5b7e7baaff2f3873e23) is the sha256 of candidate.json, not of A11.input.json, whose sha256 is 4e544b30b9592f0d7be3ccd8d257f4f5f22323d8c568535795f10972600aac80. I verified the candidate embedded in A11.input.json is byte-identical in canonical form to candidate.json, so the artifact judged is the current one and the pass stands. The runner should quote the input file's own digest in the handoff."
  ],
  "model": "claude-opus-5[1m]",
  "token": "f2468186c3b516bb1a77a5c87fd9deb61167a7c67840ba052ddc596124666ffe"
}
