{
  "verdict": "pass",
  "reasons": [
    "Integrity: A11.input.json embeds a candidate byte-identical to candidate.json at sha256 dae68dc209a8b7dae8371b61b7995d47551ec3820aae17d1ecd40f8aa86850d2 (canonical-form comparison equal). Judged the verified artifact.",
    "Mechanical pre-pass clean. 29 declared el_ids collected across panel ids, spine nodes, edges, hidden entries, scale segments and chips, money flow rows and incidence lanes; no duplicates. Every els entry of all 12 sentences (6 en, 6 id) resolves into that set; zero unresolved bindings.",
    "Panel coverage complete: all four panel el_ids (tariffs-pay-claim-map, tariffs-pay-scale-check, tariffs-pay-money-flow, tariffs-pay-incidence) are bound by at least one sentence in BOTH locales. Unbound elements are lanes, chips and hidden entries only (tariffs-pay-inc-ledger, the four sc-chip-*), which carry no coverage requirement.",
    "Lexicon clean in both locales: 0 whole-word hits for any en or id verdict term and 0 matches on the fact-check-colon phrase pattern, scanned over all 393 user-facing copy strings with not_copy_keys applied and the id-as-locale-key exception honoured. The 'salah satu' whole-word trap does not occur. Style clean: 0 em dashes, 0 emoji.",
    "No orphan numbers: all 22 Value objects carry a source_id. Future-tense-harm is vacuous here, echo is null and neither historical.outcome nor cases.documented_outcome exists, so the scoped surfaces are absent.",
    "Round 1 fault on id v-4 is repaired at the root, not papered over. The sentence now heads its enumeration with the neutral locative 'Di luar bingkai berdiri' and carries no collective payer noun. Each party is characterised as its own element characterises it: the importer plus the households behind it as bearing the duty (h-first-payer), the domestic producer as raising prices under the umbrella so part of what buyers pay 'menjadi pendapatan mereka dan tidak pernah sampai ke kas negara', which is h-price-umbrella's own label and why_hidden making it a collector rather than a payer, and the exporter facing countermeasures (h-retaliation-offsets). The court clause is split into its own sentence and binds h-refund-contingency, so it is not enumerated as a party.",
    "en v-5 carries the same shape and is equally clean: 'Outside the frame stand the importer of record..., the domestic producer pricing up under the tariff umbrella, and the exporter facing countermeasures' uses no collective payer head and characterises the producer as pricing up, matching h-price-umbrella.",
    "Edge status is never upgraded in either locale. en v-3 and id v-2 describe tariffs-pay-e-revenue-scale (unsourced) as having no registry entry behind it and tariffs-pay-e-scale-funded (missing) as having neither a registry entry nor a line in the article, with the conclusion arriving from the order of two sentences rather than from what either says. Both readings track the edges' own why text; the missing edge is never rendered as supported, and the supported edge (en v-2, id v-1, 'carried from both ends') matches tariffs-pay-e-lever-revenue's why verbatim in substance.",
    "Every figure in prose resolves inside its own sentence's bound elements, checked per sentence rather than against the artifact at large: $194.9B, $5.23T, $1,338, $1,130, $2.5T, $3.0T, $4.1T in en; US$194,9 miliar, US$5,23 triliun, US$780, US$1.338, US$2,5 triliun, US$3,0 triliun, US$4,1 triliun, US$718 miliar in id. The id-only US$718 miliar traces to the bound h-interest-gap and the id-only US$780 to the bound inc-households-expiry.",
    "Characterisations trace to the graph the sentence binds to. en v-4's 'never records what any line pays for, because receipts arrive as one pool' reproduces both the claim and its stated reason from tariffs-pay-mf-customs.note, and the generalisation from the tariff line to any line is exactly what that note's 'receipts arrive as one pool' asserts; id v-3 states the narrower per-line form matching the note verbatim. id v-6's '$4.1T score ... yang tidak pernah tampil di halaman aslinya' traces to bound h-cost-side, whose value is the same $4.1T on the same source and window.",
    "Scenario discipline held, which the incidence panel explicitly demands ('the two scenarios are never mixed'). en v-5 pairs $1,338 and $1,130, both extension scenario, before and after substitution. id v-5 sets US$780 against US$1.338 with each explicitly labelled by scenario and both taken at the same pre-substitution stage, a labelled like-for-like comparison rather than a mixed range, and the follow-on claim that substitution lowers both is true of both bound lanes.",
    "id v-5's 'menyusun pembayarnya menurut waktu' does not repeat the round 1 pattern: the enumeration under it names only importir and rumah tangga, each a payer per its own lane, while the non-payer lane tariffs-pay-inc-ledger is neither enumerated nor bound, so the collective noun's scope matches what follows it.",
    "Noted and deliberately not blocked, outside this gate's remit and verified harmless: stored counts recompute exactly under the validator's rule, unsourced 3 = 1 unsourced edge + 2 hidden entries lacking ev (h-price-umbrella, h-retaliation-offsets); missing 1, supported 1, disputed 0, hidden 7 all match. Locale divergence in which hidden entries each narration surfaces is an editorial choice, not a traceability fault, and panel coverage holds in both."
  ],
  "model": "claude-opus-5[1m]",
  "token": "e17e84b1cf140aa3f828f24d912ebb4f636ba0c29ab30ad06e05425bef80ab8c"
}
