{
  "verdict": "pass",
  "reasons": [
    "Integrity check passed. candidate.json hashes to 862aa887257165eaa2c47416142afcb6881314805cb2a0f29311a6c3e55c60d0 as stated, and the candidate embedded in A10.input.json is byte-equivalent to it (no mirror brief supplied; mirror constructed here). Stored counts recompute correctly against Section 6.5: missing 1 (e-scale-funded), unsourced 3 (e-revenue-scale plus the two hidden entries shipping without ev, h-price-umbrella and h-retaliation-offsets), supported 1, hidden 7. The artifact counts its own unsourced hidden branches against itself rather than hiding them.",
    "Edge statuses survive the mirror test and sit at the generous end for the artifact's own framing. On a 4-node spine the gov claim gets 1 supported / 1 unsourced / 1 missing. The supported call on e-lever-revenue rests on a primary Treasury document plus two independent forward projections, which is a standard the mirror would also clear. Across this run the opp-lean slots built by the same method get 0-1 supported and 2-3 missing (mbg-stop 0 supported / 2 missing; usaid-deaths 1 supported / 3 missing; mbg-poisoning 1 supported / 1 missing), so the framing under audit is treated no harder than the mirror. The 4-node decomposition of a six-word original into magnitude and settlement is the house pattern applied identically at both leans (mbg-stop and usaid-deaths both take 4-node spines with terminal missing edges), not a device to manufacture two failures from one assertion.",
    "Hidden-branch count is not asymmetric rigor. Seven branches, all cutting against the framing, which is what the schema's hidden list is for. The lean-invariant check is the corpus band: gov-lean slots run 5-8 (judol 7, mbg-jobs 8, migrant-crime 7, ppn-panic 5, usaid-deficit 5) and opp-lean slots run 6-8 (mbg-poisoning 6, mbg-stop 6, usaid-deaths 8). Seven is median for either lean, so the same method aimed at the mirror surfaces the same volume.",
    "The two scale panels are distinguishable at the point of reading, in both locales. They share a heading only because PANEL_TITLE.scale_check is a fixed renderer constant keyed on panel type (app/src/renderers/copy.ts:125) with no per-panel override in the contract, so this is not an artifact-level choice. Each panel's first rendered line is the denominator line (ScaleCheck.tsx:47-54), and the two differ on label, value and publisher: 'Conventional score of the enacted package, primary deficits plus interest: $4.1T / Committee for a Responsible Federal Budget' against 'Total federal receipts, net, fiscal year 2025: $5.23T / U.S. Department of the Treasury'. Three further separations reinforce it: tariffs-pay-scale-share's own takeaway names the other panel directly ('It is not the decade of projections the other scale panel carries' / 'bukan proyeksi satu dekade yang dibawa panel skala yang satu lagi'); narration names each by time base in both locales (EN v-4 'a single closed fiscal year on both sides rather than the decade of projections' and v-6 'The other scale panel runs on a decade of projections instead'; ID v-3 and v-6 carry the same pair); and the denominator sparring note distinguishes them a third time. A reader arriving by scroll or by narration separates them on the first line either way.",
    "The added panel introduced no framing the mirror would not receive. Its labels are descriptive and carry no adjective, the derived share appears in no sentence in either locale (no '3.7' or '3,7' string exists anywhere in the artifact; the percentage is computed only in ScaleCheck.tsx:34-38), and the takeaway refuses the inference outright: it states the share gives the size of the tariff line 'and not what any of it paid for', because receipts arrive as one pool. The same refusal is repeated in the money_flow row note and in EN v-4 / ID v-3. Most decisively, the denominator sparring question ships $5.23T as option 2 and marks it wrong, with a note that names it 'the denominator of the other scale panel ... not a price for anything proposed'. The one reading in which 3.7 percent could have carried the claim's verdict is explicitly closed to the reader.",
    "The new panel's own evidentiary choices point gov-favorable where they had a choice. The segment uses the net customs line ($194.9B), which is forced by the net denominator and is stated as such ('the same net basis on both sides'); the larger gross line ($202.4B) is disclosed as the panel's single context chip. The panel discloses the bigger number rather than burying it. The same two-directional discipline holds on the decade panel: the superseded August $4.0T figure is shipped as a chip (gov-favorable disclosure), the two void-authority contingencies are shipped as chips (gov-unfavorable), the takeaway blocks a gov-favorable stack of $2.5T and $3.0T, and the window mismatch between a 2034 score and 2035 projections is stated in both locales. Fences run both ways on both panels.",
    "The one fence absent from the share panel is absent symmetrically, so it is not a directional gap. Nothing tells the reader that FY2025 (Oct 2024 to Sep 2025) only partly contained a schedule the registry dates as enacted 6 Jan to 15 Nov 2025, which means $194.9B is not an annualised figure and 3.7 percent is not a steady-state share. That caveat cuts against a mirror claim of 'tariffs bring in almost nothing' exactly as much as it cuts for the framing here, no registry entry states it, and the artifact never uses the share as evidence against the claim in the first place. Worth noting upstream as a possible strengthening, not an asymmetry.",
    "Burden of explanation is lean-invariant. The sparring move set is mechanism / denominator / incidence, identical in all ten slots of this run at every lean, so the framing is not singled out for interrogation. Temperature and style are clean: a full scan of 214 user-facing strings found no C1 verdict lexicon in either language (no salah/salah satu false positive either), no em dashes, no en dashes, no emoji, no scare quotes, and no loaded verb applied to one side (no admits/claims/so-called/mengaku/mengklaim). FactCheck's 'Don't Come Close' headline appears only in ev.quote citation fields as the source's own title and is never adopted in the artifact's voice; the artifact says the registry holds no entry stating the scale step rather than borrowing the outlet's conclusion."
  ],
  "model": "claude-opus-5[1m]",
  "token": "68affdc305eaff118eab6ad2bd59fe983b2ff3f5d4e2d1e41723a02da8988eda"
}
