{
  "verdict": "pass",
  "reasons": [
    "PROVENANCE: candidate.json sha256 = ee67f68c694c40829a68b26ec01cfda65576112eebad11c6b60e06abd8c7597f, matching the declared hash; the candidate embedded in A11.input.json is deep-diff identical to those bytes. Judged the verified artifact.",
    "PASS ONE, el_id inventory: 27 declared ids collected exhaustively - 2 panel ids (mbg-jobs-claim-map, mbg-jobs-scale-check), 5 spine nodes n1-n5, 4 edges e1-e4, 8 hidden h1-h8, 3 scale segments, 5 context chips. No family marker el_id exists (family carries only skeleton and members; the schema gives it none). echo is null and no echo-type panel sits in panels[], so there is no echo el_id to collect.",
    "PASS ONE, bindings: all 12 sentences (6 en, 6 id) resolved. Every entry of every els array is a declared el_id. Zero unresolved bindings in either locale.",
    "PASS ONE, coverage: both panel el_ids are bound in BOTH locales (en: claim-map at v-1, scale-check at v-6; id: claim-map at v-1, scale-check at v-5). Echo is null, so no echo coverage is owed - this matches the validator rule at scripts/validate-content.ts:334-357, which adds echo.el_id to the covered-panel set only when echo is present. Beyond the required minimum, all 27 elements are bound in both locales; no element is orphaned.",
    "PASS ONE, lexicon: 286 copy strings scanned in both locales with not_copy_keys applied, including the documented `id` collision rule (treated as copy wherever the object carries an `en` string sibling). Zero verdict-word hits from either the en or id list, zero hits on the fact-check colon construction. The `salah satu` trap is clear - the substring `salah` does not occur anywhere in the artifact. The entire candidate is pure ASCII, so no em dash and no emoji. Future-tense harm is vacuous and verified so: echo is null, no historical or cases key exists anywhere, and no future-harm pattern or hedge occurs anywhere in the artifact regardless of scope.",
    "PASS ONE, orphan numbers: 16 Value objects located; every one carries a non-empty source_id. Zero orphans. Edge ev without source_id on e4 is schema-legal and correct - narrative.schema.json makes edge ev.source_id optional precisely so a `missing` edge can carry none, while the strict Evidence def used by hidden entries requires it, and h4/h7/h8 each supply it.",
    "PASS ONE, counts: recomputed against the derivation in pipeline/run.ts:244-258 and contracts/types.ts:235-238. Derived {missing 1, unsourced 5, disputed 0, supported 3, hidden 8} equals the declared counts exactly. The 5 unsourced are hidden entries without ev: h1, h2, h3, h5, h6.",
    "PASS TWO, figures: every numeral in narration prose, both locales, resolves inside an element that sentence binds. This includes the derivation multiplicands 47 and about 21,000 in en v-6 and id v-6, which are carried in chip-feb-baseline's own label copy in each locale and check arithmetically: 47 x 21,000 = 987,000, the chip's stated amount. As-of qualifiers hold: realized-through-May on the Rp88.15T lines, end-May on the 29,679 kitchens, May 2026 on the 1.28M and 142,387, February 2026 on the 987,000, enacted-for-2026 on the Rp3,842.7T denominator and the debt-interest and energy-subsidy segments.",
    "PASS TWO, edge status: no upgrade in either locale. e1/e2/e3 are `supported` and each carries an ev.quote; id v-2's claim that the first three steps have a quote stating them is true of the graph as it stands. e4 is `missing`, and both en v-3 and id v-3 narrate it strictly as an absence, in wording that matches e4.ev.quote and e4.ev.why.id respectively. Neither locale describes the missing step as if it were supported, and neither downgrades a supported step.",
    "PASS TWO, attribution and parties: the self-reported attribution is asserted only where the flag exists - en v-2 about n3 and n4, id v-6 about chip-feb-baseline and chip-workers, all four flagged self_reported. Neither locale extends that attribution to n1 or n2, which are sourced outside the programme. Every named party (school canteen and stall vendors, MSMEs and small livestock farmers, suppliers, absorbed workers) is declared by a spine node or a hidden entry that the sentence binds.",
    "PASS TWO, characterisations: each absence claim matches the why_hidden or ev.why text of the element it binds - `never enters the frame` to h7, `never set beside the headcount` to h4, `a payroll-grade count has not appeared` to h2, `the source side is never named` to h8, `measures participation rather than receipts` to h5. Cross-locale check per A9: the two narrations reach the same point by different routes, as intended, and do not disagree about any fact.",
    "PASS TWO, echo: the artifact carries no echo, and no sentence in either locale asserts anything about an echo, a precedent or a historical outcome. The echo rule is satisfied because there is nothing claimed about an echo the artifact does not carry, not merely because the field is null - I checked the narration for echo and precedent references and found none.",
    "NOTE, not a fidelity fault and not a reason to block: e1's ev.why ends `No article in this family states the step`, yet e1's ev.quote (`Anggaran MBG Terserap Rp 88,15 Triliun hingga Mei 2026`, source id-kompas-mbg-sppg-mei2026) is verbatim the headline of family member 3. That tension lives inside the edge's own evidence prose and belongs to the edge-status gate, not to narration fidelity. No sentence in either locale leans on it: id v-2 claims only that the first three steps carry quotes, which the graph supports, and neither locale asserts anything about whether a family article states step one. Flagged for the orchestrator as an upstream observation, not as a fault in any sentence."
  ],
  "model": "claude-opus-5[1m]",
  "token": "9002cb45f5be8c44eb115c14c097319f65b3e7b41d59b58f1e9335ab5a35f3b0"
}
