{
  "verdict": "pass",
  "reasons": [
    "Integrity: embedded candidate is deep-equal and canonical-hash-equal to candidate.json, which hashes to the declared sha256 62a7725f59ca8bf4360d1e23809a2f91f38f633f758f8505681dcc7d096a03aa.",
    "Pass one, declared el_ids: 17 collected across panels[] (mc-panel-claim-map, mc-panel-dueling), 3 spine, 2 edges, 7 hidden, 3 dueling counts. echo is null, so no echo el_id exists; there is no family-marker panel and no narration sentence binds one.",
    "Pass one, bindings: all 12 sentences (6 en, 6 id) resolve every els entry against the declared set. Zero unresolved bindings in either locale.",
    "Pass one, coverage: both panel el_ids are bound by at least one sentence in BOTH locales (en v-1/v-6, id v-1/v-6). Beyond the requirement, all 17 declared elements are bound in each locale independently; no unbound element in either.",
    "Pass one, lexicon: 206 user-facing copy strings scanned in both locales against the 6.9 verdict lists and the fact-check colon pattern. Zero hits. The only whole-word 'true' in the artifact is the JSON boolean og.fallback, which is not copy; 'lie' occurs only as a substring of 'clients' and 'earlier'; 'salah satu' does not occur. No scalar quality score for any narrative or outlet. Style clean: zero em dashes (U+2014), zero emoji.",
    "Pass one, future-tense harm: scope surfaces historical.outcome and cases.documented_outcome are absent from this artifact (echo is null, no case library), so the rule has no surface to violate.",
    "Pass one, orphan numbers: all 7 Value objects carry a source_id (mc-hid-arrival-victims, mc-hid-reporting-rate, mc-hid-comparator-rate, mc-hid-baseline-year, mc-duel-cato, mc-duel-pnas, mc-duel-fbi). All three cited ids resolve in content/sources.json.",
    "Pass one, counts recomputed from the graph: missing 2, unsourced 2, disputed 0, supported 0, hidden 7, conflicts 3. Exact match to the declared counts block.",
    "Pass two, figures: every numeral in prose appears in a bound element's value or quoted evidence. en v-3 and id v-5 44/29 to mc-hid-arrival-victims and mc-hid-reporting-rate; en v-5 and id v-4 14.9 to mc-hid-baseline-year; en v-6 and id v-4 2x to mc-duel-pnas and mc-hid-comparator-rate; en v-6 and id v-6 4.5 to mc-duel-fbi. Word-numbers also check out: 'three steps'/'tiga langkah' equals 3 spine nodes, 'two joints'/'Dua sambungan' equals 2 edges, 'Three instruments'/'Tiga instrumen' equals 3 dueling counts, 'Dua tolok ukur' equals the 2 hidden entries that sentence binds.",
    "Pass two, the two FBI figures do not collide: -14.9 percent is scoped by mc-hid-baseline-year's evidence to murder and non-negligent manslaughter, -4.5 percent by mc-duel-fbi's method to reported offenses nationally. Narration preserves that distinction in both locales.",
    "Pass two, edge status: both edges are status missing. en v-2 ('never written down', 'nothing in this family states') and id v-2 ('tidak pernah dituliskan') describe them as missing with no upgrade toward supported. The instrument clause in en v-2 traces verbatim to mc-edge-offending-wave.ev.why.en.",
    "Pass two, characterisations: each traces to the graph it binds. 'the word above without the level it is above' to mc-hid-comparator-rate.why_hidden; 'prices every subgroup at a single rate' to mc-hid-status-bundling; 'a divisor that settlement itself keeps growing' to mc-hid-population-denominator; 'stays undrawn' to mc-hid-counterfactual-trend; the three-questions line in en/id v-6 to mc-panel-dueling.rule_line verbatim in each locale.",
    "Pass two, named parties: undocumented immigrants, legal immigrants, US-born citizens and the three instruments are all declared by mc-duel-pnas.method, mc-duel-cato, mc-duel-fbi and mc-hid-status-bundling.ev.",
    "Echo clause not engaged: echo is null (as in 9 of 10 slots this run), and no narration sentence in either locale makes any claim about a historical echo.",
    "Examined and cleared, not blocked: en v-6 asserts the PNAS direction (US-born arrested at over 2 times the rate of undocumented immigrants) while binding mc-duel-pnas, which carries the magnitude and the compared parties but not the direction. The direction is stated verbatim by mc-hid-comparator-rate.ev.quote in the same graph, so the claim traces to an element; id v-4 binds both together for the same claim. A looser binding, not a fidelity fault.",
    "Examined and cleared, not blocked: en v-3 compresses 'Immigrant victims of violent crime' to 'their reporting of incidents to police'. The bound element mc-hid-reporting-rate carries the claim in its evidence quote, and id v-5 states the victim scoping precisely ('kemungkinan korban imigran melapor')."
  ],
  "model": "claude-opus-5[1m]",
  "token": "591735f087db266c535c294109679dfa76430cf52c62d835da26e50032e39964"
}
