{
  "verdict": "pass",
  "reasons": [
    "Integrity: embedded candidate is object-identical to staged candidate.json, sha256 62a7725f59ca8bf4360d1e23809a2f91f38f633f758f8505681dcc7d096a03aa, matching the tasked hash; mirror_brief is null so the mirror was constructed as the same event and evidence family (en-cato-pa1003, en-pnas-light-2020, en-fbi-2024-crime) with the lean flipped: immigrants named driver of the crime decline.",
    "Edge statuses symmetric: both spine edges (mc-edge-arrivals-offending, mc-edge-offending-wave) are 'missing' with supported:0, and both why-texts are lean-invariant — the arrivals-to-rate step is unwritten regardless of the rate's direction, and the instrument argument (FBI splits by offense type, never by nativity) denies the mirror an attribution of the 4.5% decline exactly as it denies the candidate a wave.",
    "Hidden-branch rigor symmetric: of 7 branches against the artifact's own framing, 5 (denominator, baseline year, status bundling, counterfactual trend, reporting conversion) are direction-neutral machinery that the same method would surface verbatim against the mirror, yielding a comparable count; no sharp differential.",
    "The two value-carrying branches whose numbers favor the mirror lean (44% victimization in mc-hid-arrival-victims, 2x comparator in mc-hid-comparator-rate) are capped with the limits a mirror audit would demand: PNAS scoped 'arrests, not offenses and not victims' in a single state and undercut as a class comparator by mc-hid-status-bundling; NCVS scoped victims-only; the dueling rule_line strips all three instruments of probative force on the named offending rate, denying the mirror's conclusion as firmly as the candidate's.",
    "Depth symmetric: all three dueling instruments receive identical anatomy (who, full method line, period, value with as_of, source_id), and the mirror-friendly instruments carry their limiting caveats inside their own method lines; counts.unsourced:2 honestly tallies the two quote-less hidden branches (mc-hid-population-denominator, mc-hid-counterfactual-trend) rather than dressing the artifact's own ammunition as sourced.",
    "Temperature and burden symmetric: no loaded adjectives, scare quotes, 'so-called'/'admits', or asymmetric speech-verbs ('claims' appears only as the claim-map's technical noun/step-sense); sparring standards (write the joint down, name the denominator, follow the mechanism's reach) are lean-invariant and narration v-6 closes on 'none of them is the offending rate the claim names' without asserting the mirror's conclusion.",
    "C1 verdict-free holds: the only lexicon hit is the JSON boolean og.fallback=true, not user-facing copy; no EN or ID verdict word and no narrative or outlet scoring anywhere in the copy. C8 clean: zero em dashes, zero emoji.",
    "Non-blocking metadata note: the tasking message stated lean 'opp' while the hash-verified artifact and staged candidate.json both carry lean 'gov'; the audit flips the framing itself so the symmetry result is invariant to the label, but the registry metadata should be reconciled."
  ],
  "model": "claude-fable-5",
  "token": "591735f087db266c535c294109679dfa76430cf52c62d835da26e50032e39964"
}
