{
  "verdict": "pass",
  "reasons": [
    "Candidate integrity: the candidate embedded in A11.input.json is deep-equal to the staged candidate.json, whose sha256 is 061048f185bb468d4bff1c0dca095f2f5a74ecec0a4bf1072df50c85ccc06c2e, matching the hash given.",
    "Pass one, bindings: 17 el_ids declared (claim-map panel + 3 spine + 2 edges + 5 hidden; scale-check panel + 2 segments + 3 chips), no duplicates. All els entries in all 6 sentences in both locales resolve to that set. No declared el_id is left unbound.",
    "Pass one, coverage: usaid-deficit-panel-claim-map is bound by v-1 and usaid-deficit-panel-scale-check by v-5, in BOTH locales. echo is null by A8's reasoned decision (why_null records all four case-library candidates rejected at the structural threshold), so there is no echo panel id to cover.",
    "Pass one, orphan numbers: all 6 Value objects (denominator, 2 segments, 3 chips) carry source_id en-kff-tracking-feb2025. Every numeral appearing in narration or sparring prose (26, 1, 11, 58, 34 percent) resolves to an element value; 'three steps' matches 3 spine nodes, 'Both joins'/'Dua sambungan'/'berhenti dua kali' matches 2 edges, 'either bar'/'kedua batangnya' matches 2 segments.",
    "Pass one, lexicon: no banned verdict word in either locale on whole-word OR substring scan, and no fact-check colon construction. The single 'false' in the file is the JSON boolean og.fallback, not copy; the four 'lie' substrings are inside believes, belief, suppliers, supplies and are not whole-word hits. No 'salah satu' trap present. No scalar quality score anywhere.",
    "Pass one, style and future-harm: the artifact is pure ASCII, so no em dash and no emoji in any user-facing string in either language. The future-harm scoped surfaces (historical.outcome, cases.documented_outcome) do not exist in this artifact.",
    "FIXED, the discarded denominator: the $5,234.6B Treasury figure is gone from the entire artifact, not merely from the panel. No dollar sign and no '5,234' occurs in any string, in either locale, in narration, sparring, takeaway or element copy. No sentence and no sparring span describes it as the panel's base.",
    "FIXED, v-5 re-authored in both locales: EN v-5 and ID v-5 now name the panel's actual base ('the size the claim asserts' / 'ukuran yang dinyatakan klaim tersebut'), which matches denominator.value = 26 percent from en-kff-tracking-feb2025 and the 100.0% / 3.8% render. Both state the second is read against the first because both are shares of the same budget, tracing to the takeaway, and both give the reason no dollar amount sits on either bar, tracing to the takeaway's own clause.",
    "FIXED, the denominator sparring item is coherent end to end: the stem asks which base the panel uses, correct index 1 is 'The size the claim asserts: the 26 percent of the federal budget respondents averaged', which is the panel's actual denominator. Option 0 (Treasury FY2025 receipts) is now a distractor, and both notes name the claim's asserted size as the base and relegate federal receipts to 'a different total from the budget a budget share is a share of', traceable to hidden[0] and hidden[1] why_hidden in both locales.",
    "FIXED, the self-standard gap: the panel's base is sourced, and the artifact now states what it cannot show and why in three places per locale (takeaway, v-5, sparring note) rather than exempting its own copy. No magnitude claim in the artifact's own voice lacks a stated base; 'a very large share' and 'substantially' occur only as the claim's own steps, framed as such by v-1 in both locales. No bare numeral remains in prose beyond the reach of a renderer invariant.",
    "Pass two, remaining sentences trace: v-1 to the three spine labels as the claim's steps; v-2 to both edges, describing them as unstated with no upgrade of their missing status; v-3 to hidden[0] and hidden[1], whose why_hidden carry the numerator requirement and the deficit base; v-4 to hidden[2], hidden[3], hidden[4]; v-6 to the three chips at 11, 58 and 34 percent, mirroring the chip labels without extending them. The ~1 percent actual share is attributed to the poll in both locales, matching the element's own attribution.",
    "Considered and not blocked: in the denominator note, 'The panel says why:' extends into a clause whose substance sits in the claim map's hidden entries rather than the scale_check takeaway. Every factual component is carried by an element of this artifact, it describes no discarded denominator and upgrades no edge status, so this is attribution granularity, not an assertion the graph does not carry."
  ],
  "model": "claude-opus-5[1m]",
  "token": "7cf4a40f6961fc201b6438760cd3bf4e028766087fe30cc20cdf752c22b09704"
}
