{
  "verdict": "pass",
  "reasons": [
    "Integrity: the attested sha256 df7b90d4… is candidate.json; the candidate embedded in A10.input.json is byte-identical to it. Six panels with the family marker {type:'family', el_id:'mbgstop-p-family'} appended last, matching the frozen 6.4 FamilyPanel contract; narration v-2 (EN and ID) binds mbgstop-p-family and every narration els reference resolves. Counts match the 6.5 mechanical derivation (unsourced 3 = edges e1+e2 plus hidden h6 without ev; missing 2; hidden 6; supported and disputed 0).",
    "Edge statuses are lean-blind (audit dim 1): the taxonomy tracks statement existence, not side — headline-asserted steps with no registry entry are unsourced (mbgstop-e1, mbgstop-e2), steps stated by no family member are missing (mbgstop-e3, mbgstop-e4), and zero edges are graded supported. The mirror's equivalent edges (keep → nutrition rescued; keep → jobs protected) would draw the same statuses from the same registry, and the artifact itself refuses to assert them: the recipients lane says nutrition outcomes 'are measured over years', never achieved, and every jobs/suppliers figure is provenance-flagged.",
    "The evidence the artifact's own counter-framing leans on is scrutinized harder, not softer (audit dims 2 and 4): 1.28M workers, 987,000 February workers, and 142,387 suppliers carry self_reported (and estimate) flags with method notes ('a derived estimate rather than a headcount', mbgstop-row-workers-feb), disclosed in both narrations (EN v-3/v-4, ID v-4); mbgstop-opt-qc-first names the operator as 'the same body whose count is under examination' and mbgstop-opt-independent-count surfaces the BPOM counting dispute.",
    "The mirror's hidden branches are present in the artifact (audit dim 2): the opp side's motivating fiscal evidence gets full numeric standing with sources (scale_check: Rp599.44T interest segment, Rp689.1T deficit and Rp9,920.42T debt chips), and the opp mechanism's valid kernel is conceded in the treasury lane (mbgstop-lane-treasury: 'a stop reaches only what has not yet been paid out'; contracts and wind-down settled before any figure is booked as saved) rather than buried.",
    "Temperature and burden are even (audit dims 3 and 5): zero C1 verdict-lexicon hits across all 285 user-facing copy strings in both languages, no outlet or narrative scoring, matched attribution verbs ('asserts' for the headline's causal steps vs 'reported/stated by the body that runs the programme' for operator counts — no claims-vs-says split), no scare quotes; C8 clean (no em dashes, no emoji). The playbook puts the first burden on the artifact's own most-used figure (mbgstop-play-realization: verify the Rp88.15T line) and routes the headline's corruption premise to the audit-mandate question (mbgstop-play-audit) instead of dismissing it; ID narration v-6 keeps the stop named as an option on the table.",
    "Cross-language symmetry holds: EN and ID narrations carry the same statuses (v-2 in both), the same self-reporting and estimate hedges, and the same deficit/debt context (EN v-5, ID v-3); neither language softens or sharpens a side the other does not."
  ],
  "model": "claude-fable-5",
  "token": "f2468186c3b516bb1a77a5c87fd9deb61167a7c67840ba052ddc596124666ffe"
}
