{
  "verdict": "pass",
  "reasons": [
    "Audited bytes sha256 65c87d25806e74247b0fa13365b7bd90d6d7838d614c245bf9c704c91f0b5b3b; no mirror brief supplied, so the mirror was constructed: a pro-government wave on the identical skeleton (recycled rally footage recirculated as live proof of massive support, absent coverage read as deliberate suppression by hostile newsrooms, closing call to amplify).",
    "Edge statuses are lean-independent. All three joins (demoagustus-e1, -e2, -e3) are unsourced on structural demands that transfer one-for-one to the mirror: e1 demands recording dates before footage can carry 'now', e2 demands an instruction, a channel, and a compliant newsroom before absence can carry 'deliberate', e3 demands a reason absence obliges amplification. e2 keeps the silencing step unsourced on those grounds rather than downgrading it because the communications minister denied it; the denial is quoted with citation as 'the nearest institutional statement' and never adopted as counter-proof.",
    "Hidden-branch count is symmetric. All eight branches (h1 recording dates, h2 event/coverage denominator, h3 operating chain of a silencing, h4 account concentration, h5 self-feeding loop, h6 people in frame, h7 exposed reposters, h8 accused newsrooms) are available against the mirror wave by the same method; none exists only because this wave is anti-government. Branches cutting against state actors are surfaced, not buried: h7 and the reposter lane record that a detention in Ciamis landed on an individual account of about 33,400 followers while 'no entry in this registry records a case opened against' the accounts most central to the volume pattern.",
    "Temperature is even. No verdict words in either language (mechanical sweep clean for the C1 lexicon in English and Indonesian; the two grep hits on 'salah' are the substring of 'masalahnya' inside a cited researcher quote, a lint false positive, not a stance leak). The artifact never asserts in its own voice that no demonstration occurred; it says the chain never dates its clips and that the documenting outlets date part of the footage to Bundaran HI 12 June 2026 and to Makassar August 2025. Suspicion is attributed throughout ('diduga', researchers' suspected automation, the cited Kompas 'Ada Dugaan' headline). The one vivid phrase, h8's 'spends their reputation as its proof', describes the chain's mechanism and would read identically against the mirror.",
    "Depth is symmetric: the dissection's own load-bearing evidence gets the same scrutiny it applies to the wave. Bases are kept apart (34,935 analysed X posts vs about 197,000 posts across five platforms vs 63,000 unique accounts), the 68.1 percent urgency-hook figure is flagged as an estimate, the scale takeaway concedes the five-platform composition is unopened, and the ministry statement is explicitly bounded ('answers the accusation; it does not measure what the accusation costs a newsroom').",
    "Burden of proof is placed on the mechanism, not on one political side. Every option in the options panel carries a real cost, including the institutional one: the 'wait for confirmation' option notes 'The institution asking for the wait is the same one that opens cases over the clips'. Sparring questions interrogate the chain's loop, denominator, and incidence; the incidence question directs attention to state exposure falling on the smallest participant. Indonesian and English narration carry the same statuses, figures, denial, and hedges at the same temperature (content of EN v-2/v-4 is reordered across ID v-2/v-4 but equivalent).",
    "Fault to fix, not load-bearing for this gate: counts.unsourced is 4 but the claim map carries exactly three unsourced edges (e1, e2, e3) and no fourth statused element exists in the artifact; the tally is off by one and should be corrected upstream.",
    "Fault to fix, not load-bearing for this gate: the context chip demoagustus-chip-unique-accounts carries unit 'people' for a quantity its own label and the sparring notes insist is accounts, in an artifact whose scale takeaway turns on posts and accounts not being people; the unit should read as a count of accounts. No C8 faults: no em dashes and no emoji in user-facing copy."
  ],
  "model": "claude-fable-5",
  "token": "27f0fe43fd6748ef9746331f3005ed4831e2f548a50abac64b6ddb32435add2f"
}
