{
  "verdict": "pass",
  "reasons": [
    "Input integrity verified: the candidate embedded in A11.input.json is deep-equal and canonical-equal to candidate.json at sha256 dd38e9c29d71964091a4c17b47f6235821d96bab7750deda4a431854607c725b.",
    "Pass one, bindings: 22 el_ids declared (3 panels, 4 spine nodes, 3 edges, 6 hidden entries, 3 dueling counts, 3 incidence lanes), no duplicates. Every els entry in all 12 sentences resolves to a declared id; zero unresolved.",
    "Pass one, coverage: panel-claim-map, panel-dueling and panel-incidence are each bound by at least one sentence in BOTH locales. No declared el_id is left unbound in either locale.",
    "Pass one, orphan numbers: all 7 Value objects carry a source_id (s-program 63130000, h-kitchens 1280000, d-bgn 6517, d-bpom 9089, d-jppi 8649, i-kitchens 29679 and 142387). None orphaned.",
    "Pass one, lexicon: whole-word case-insensitive sweep of all 360 strings in both locales returns zero EN verdict words and zero ID verdict words, including no 'salah satu' trap. No 'fact-check:' colon construction. No scalar quality score for a narrative or outlet. The only raw 'false' in the file is the JSON boolean at og.fallback, a machine value, not copy.",
    "Pass one, future-tense harm: echo is null and there is no cases array, so neither scoped surface (historical.outcome, cases.documented_outcome) exists in this artifact. No future-harm pattern appears anywhere regardless. Collective action is nowhere framed as the harm.",
    "Pass one, style: zero em dashes and zero Extended_Pictographic codepoints in any user-facing string in either locale.",
    "Pass two, EN v-6 (round 1 block) is fixed. '29,679 SPPG kitchens were operating as of May 2026' carries i-kitchens' own as_of, '1.28 million program workers at the same date' carries h-kitchens' as_of, and the service-unit fact is stated in the element's own generic form verbatim from i-kitchens ('A service unit cooked every counted meal'). The clauses are conjoined, not causal, so the May 2026 kitchen population is no longer joined to the 2025 counted cases. ID v-6 applies the same discipline: 'per Mei 2026' on the figure and a generic stopping clause, 'ketika sebuah unit berhenti memasak'.",
    "Pass two, edge status is never upgraded in either locale: e-serve-poison (supported) reads as carried by sources outside the story, e-poison-count (disputed) as the point where the sources part, e-count-scale (missing) as the step no source takes. EN v-2 and ID v-2 both state the missing edge as missing.",
    "Pass two, every figure in prose resolves to an element value or as_of: 63.13 million (s-program), 6,517 / 9,089 / 8,649 (d-bgn, d-bpom, d-jppi), 1 October 2025 and 27 September 2025 (their as_of fields), January 2025 (d-bgn method and period), 29,679 (i-kitchens), 1.28 million (h-kitchens), May 2026 (as_of on both). EN v-3 explicitly qualifies JPPI with 'through 27 September' rather than letting it inherit the 1 October frame.",
    "Pass two, every named party is declared: BGN, BPOM and JPPI by dueling counts; puskesmas, district hospitals and district health offices by i-frontline; SPPG service units, crews and local suppliers by i-kitchens and h-kitchens.",
    "Considered and cleared: v-4 in both locales attributes non-publication of the case rule to the three counting bodies where h-count-method's why_hidden scopes the absence to articles. The entry's own label puts the absence on the figures themselves ('The case definition and counting method behind each published figure' / 'Definisi kasus dan metode penghitungan di balik tiap angka yang diumumkan'), and a hidden entry is by construction an assertion that the item is absent from the reader's view, so this is paraphrase of the bound element rather than a claim it does not carry. The other two clauses are near-verbatim from h-denominator-served ('the served base it accumulated on') and h-baseline-klb.",
    "Considered and cleared: EN v-5 and ID v-6 attribute the KLB investigation collectively to 'the puskesmas and district health offices', where i-frontline assigns the investigation to the district health office. i-frontline treats the lane as one actor group and states 'The label the national dispute is fought over is produced here', so the collective attribution is within the element."
  ],
  "model": "claude-opus-5[1m]",
  "token": "8a5d85f60982d66ca8c951963bc206539e8f88c61cf64d3002afc32a621fec67"
}
